{
  "$schema": "https://json-schema.org/draft/2020-12/schema",
  "$id": "https://raw.githubusercontent.com/hey-research-lab/rhchain-registry/main/schema/registry-entry.v1.json",
  "title": "Robinhood Chain registry entry (v1)",
  "description": "One file under registry/<folder>/<id>.json. Lists public facts about Robinhood Chain infrastructure with their sources. Registry presence is not a Verified Builder, not an endorsement and not HEY verification; a contract listed here does not establish who owns it. Checks this schema cannot express (EIP-55 checksums, unique ids and addresses across the registry, URL normal form, wording) are enforced by the package validator.",
  "type": "object",
  "additionalProperties": false,
  "required": ["id", "name", "type", "chainId", "status", "contracts", "sources", "addedAt"],
  "properties": {
    "$schema": { "const": "../../schema/registry-entry.v1.json" },
    "id": {
      "type": "string",
      "minLength": 1,
      "maxLength": 64,
      "pattern": "^[a-z0-9]+(?:-[a-z0-9]+)*$",
      "description": "Kebab-case, unique across the registry, equal to the file name without .json."
    },
    "name": {
      "type": "string",
      "minLength": 1,
      "maxLength": 80,
      "pattern": "^[\\x20-\\x7e]+$",
      "description": "Printable ASCII only."
    },
    "type": {
      "enum": [
        "factory",
        "dex",
        "launchpad",
        "bridge",
        "oracle",
        "explorer",
        "locker",
        "protocol",
        "infrastructure"
      ],
      "description": "Must match the folder: factories, dexes, launchpads, bridges, oracles, explorers, lockers, protocols, infrastructure."
    },
    "chainId": {
      "const": 4663,
      "description": "Robinhood Chain only (eip155:4663). Any other value is unsupported_chain."
    },
    "status": {
      "enum": ["active", "deprecated", "unknown"],
      "description": "Of the infrastructure entry, by its sources."
    },
    "contracts": {
      "type": "array",
      "maxItems": 50,
      "description": "May be empty only for explorer and infrastructure entries.",
      "items": {
        "type": "object",
        "additionalProperties": false,
        "required": ["address", "role"],
        "properties": {
          "address": {
            "type": "string",
            "pattern": "^0x[0-9a-fA-F]{40}$",
            "description": "All-lowercase, or EIP-55 checksummed when mixed-case. Unique across the registry."
          },
          "role": {
            "enum": [
              "factory",
              "launch-factory",
              "auction-factory",
              "router",
              "pool-manager",
              "position-manager",
              "position-descriptor",
              "quoter",
              "lens",
              "multicall",
              "library",
              "strategy",
              "permit",
              "locker",
              "bridge",
              "oracle",
              "other"
            ]
          },
          "name": {
            "type": "string",
            "minLength": 1,
            "maxLength": 64,
            "pattern": "^[A-Za-z0-9][A-Za-z0-9 _.()+-]*$",
            "description": "The contract's name as its source gives it."
          },
          "version": {
            "type": "string",
            "minLength": 1,
            "maxLength": 32,
            "pattern": "^[A-Za-z0-9][A-Za-z0-9 _.()+-]*$"
          },
          "deployedBlock": { "type": "integer", "minimum": 0, "maximum": 9007199254740991 },
          "creationTx": { "type": "string", "pattern": "^0x[0-9a-fA-F]{64}$" }
        }
      }
    },
    "website": { "type": "string", "maxLength": 500, "pattern": "^https://" },
    "docs": { "type": "string", "maxLength": 500, "pattern": "^https://" },
    "sources": {
      "type": "array",
      "minItems": 1,
      "maxItems": 10,
      "description": "Required. https URLs to public evidence: official docs, a deployments file, an explorer verified-source page.",
      "items": { "type": "string", "maxLength": 500, "pattern": "^https://" }
    },
    "notes": {
      "type": "string",
      "minLength": 1,
      "maxLength": 1000,
      "description": "Short, factual: how the sources support the entry. No verdicts, endorsements or advice."
    },
    "addedAt": {
      "type": "string",
      "pattern": "^\\d{4}-\\d{2}-\\d{2}$",
      "description": "The date the entry was added (YYYY-MM-DD, UTC)."
    }
  }
}
