{
  "$schema": "../../schema/registry-entry.v1.json",
  "id": "klik",
  "name": "Klik",
  "type": "launchpad",
  "chainId": 4663,
  "status": "unknown",
  "contracts": [
    {
      "address": "0x16cF6788B762EE8969744586eD16fc5705140dd7",
      "role": "launch-factory",
      "name": "Klik launcher"
    }
  ],
  "website": "https://klik.finance/",
  "sources": [
    "https://klik.finance/",
    "https://docs.bitquery.io/docs/blockchain/robinhood/robinhood-meme-coin-launches/"
  ],
  "notes": "The klik.finance web app JavaScript lists this launcher for chain 4663, and Bitquery's Robinhood Chain launch docs name it for Klik Finance.",
  "addedAt": "2026-10-02"
}
